{
  "$schema": "https://json-schema.org/draft/2020-12/schema",
  "type": "object",
  "properties": {
    "schemaVersion": {
      "type": "number",
      "const": 3
    },
    "name": {
      "type": "string",
      "minLength": 1
    },
    "entryScreen": {
      "type": "string",
      "minLength": 1
    },
    "roles": {
      "minItems": 1,
      "type": "array",
      "items": {
        "type": "object",
        "properties": {
          "id": {
            "type": "string",
            "minLength": 1
          },
          "name": {
            "type": "string",
            "minLength": 1
          }
        },
        "required": [
          "id",
          "name"
        ],
        "additionalProperties": false
      }
    },
    "states": {
      "minItems": 1,
      "type": "array",
      "items": {
        "type": "object",
        "properties": {
          "id": {
            "type": "string",
            "minLength": 1
          },
          "name": {
            "type": "string",
            "minLength": 1
          }
        },
        "required": [
          "id",
          "name"
        ],
        "additionalProperties": false
      }
    },
    "screens": {
      "minItems": 1,
      "type": "array",
      "items": {
        "type": "object",
        "properties": {
          "id": {
            "type": "string",
            "minLength": 1
          },
          "name": {
            "type": "string",
            "minLength": 1
          },
          "roleIds": {
            "minItems": 1,
            "type": "array",
            "items": {
              "type": "string",
              "minLength": 1
            }
          }
        },
        "required": [
          "id",
          "name",
          "roleIds"
        ],
        "additionalProperties": false
      }
    },
    "flows": {
      "type": "array",
      "items": {
        "type": "object",
        "properties": {
          "id": {
            "type": "string",
            "minLength": 1
          },
          "name": {
            "type": "string",
            "minLength": 1
          },
          "roleId": {
            "type": "string",
            "minLength": 1
          },
          "screenIds": {
            "minItems": 1,
            "type": "array",
            "items": {
              "type": "string",
              "minLength": 1
            }
          }
        },
        "required": [
          "id",
          "name",
          "roleId",
          "screenIds"
        ],
        "additionalProperties": false
      }
    }
  },
  "required": [
    "schemaVersion",
    "name",
    "entryScreen",
    "roles",
    "states",
    "screens",
    "flows"
  ],
  "additionalProperties": false
}
